{
    "$schema": "../schema.json",
    "name": "Baldwin IV",
    "skill": {
        "title": "Suprise Attack",
        "description": "Reduces enemy ranged troops' attack by 30% and enemy siege machines' attack by 20% when General is leading the army.",
        "buffs": {
            "enemy_range": {
                "attack": 30
            },
            "enemy_siege": {
                "attack": 20
            }
        }
    },
    "ascensions": [
        {
            "description": "Enemy Ranged Troop and Siege Machine Attack -5% and HP -10%",
            "buffs": {
                "enemy_range": {
                    "attack": 5,
                    "hp": 10
                },
                "enemy_siege": {
                    "attack": 5,
                    "hp": 10
                }
            }
        },
        {
            "description": "Enemy Ranged Troop and Siege Machine Defense -10%; when General is the Mayor, Training Speed in this Subordinate City +20%",
            "buffs": {
                "enemy_range": {
                    "defense": 10
                },
                "enemy_siege": {
                    "defense": 10
                },
                "trainingSpeed": 20
            }
        },
        {
            "description": "Enemy Ranged Troop and Siege Machine HP -15%; when General is the Mayor, Death into Survival Rate in this Subordinate City +10%",
            "buffs": {
                "enemy_range": {
                    "hp": 15
                },
                "enemy_siege": {
                    "hp": 15
                },
                "deathToSurvival": 10
            }
        },
        {
            "description": "Enemy Ranged Troop and Siege Machine Attack -10% and Defense -10%",
            "buffs": {
                "enemy_range": {
                    "attack": 10,
                    "defense": 10
                },
                "enemy_siege": {
                    "attack": 10,
                    "defense": 10
                }
            }
        },
        {
            "description": "Enemy Ranged Troop and Siege Machine Attack, Defense and HP -10%",
            "buffs": {
                "enemy_range": {
                    "attack": 10,
                    "defense": 10,
                    "hp": 10
                },
                "enemy_siege": {
                    "attack": 10,
                    "defense": 10,
                    "hp": 10
                }
            }
        }
    ],
    "skin": {
        "title": "Divin Guardian - Baldwin IV",
        "buffs": {
            "enemy_ground": {
                "hp": 10
            },
            "enemy_mounted": {
                "hp": 10
            },
            "enemy_range": {
                "attack": 5
            },
            "enemy_siege": {
                "attack": 5
            }
        }
    },
    "specialties": [
        {
            "title": "Mounted Troop Assault",
            "levels": [
                {
                    "mounted": {
                        "attack": 1,
                        "hp": 1
                    }
                },
                {
                    "mounted": {
                        "attack": 1,
                        "hp": 1
                    }
                },
                {
                    "mounted": {
                        "attack": 2,
                        "hp": 2
                    }
                },
                {
                    "mounted": {
                        "attack": 2,
                        "hp": 2
                    }
                },
                {
                    "mounted": {
                        "attack": 4,
                        "hp": 4
                    }
                }
            ]
        },
        {
            "title": "Snipe",
            "levels": [
                {
                    "enemy_ground": {
                        "attack": 1
                    },
                    "enemy_mounted": {
                        "attack": 1
                    },
                    "enemy_range": {
                        "attack": 1
                    },
                    "enemy_siege": {
                        "attack": 1
                    }
                },

                {
                    "enemy_ground": {
                        "attack": 1
                    },
                    "enemy_mounted": {
                        "attack": 1
                    },
                    "enemy_range": {
                        "attack": 1
                    },
                    "enemy_siege": {
                        "attack": 1
                    }
                },
                {
                    "enemy_ground": {
                        "attack": 2
                    },
                    "enemy_mounted": {
                        "attack": 2
                    },
                    "enemy_range": {
                        "attack": 2
                    },
                    "enemy_siege": {
                        "attack": 2
                    }
                },
                {
                    "enemy_ground": {
                        "attack": 2
                    },
                    "enemy_mounted": {
                        "attack": 2
                    },
                    "enemy_range": {
                        "attack": 2
                    },
                    "enemy_siege": {
                        "attack": 2
                    }
                },
                {
                    "enemy_ground": {
                        "attack": 4
                    },
                    "enemy_mounted": {
                        "attack": 4
                    },
                    "enemy_range": {
                        "attack": 4
                    },
                    "enemy_siege": {
                        "attack": 4
                    }
                }
            ]
        },
        {
            "title": "Mounted Troop Ares",
            "levels": [
                {
                    "mounted": {
                        "attack": 1,
                        "defense": 1,
                        "hp": 1
                    }
                },
                {
                    "mounted": {
                        "attack": 1,
                        "defense": 1,
                        "hp": 1
                    }
                },
                {
                    "mounted": {
                        "attack": 2,
                        "defense": 2,
                        "hp": 2
                    }
                },
                {
                    "mounted": {
                        "attack": 2,
                        "defense": 2,
                        "hp": 2
                    }
                },
                {
                    "mounted": {
                        "attack": 4,
                        "defense": 4,
                        "hp": 4
                    }
                }
            ]
        },
        {
            "title": "Battle of Montgisard",
            "levels": [
                {
                    "enemy_range": {
                        "attack": 2,
                        "hp": 1
                    },
                    "enemy_siege": {
                        "attack": 2,
                        "hp": 1
                    }
                },
                {
                    "enemy_range": {
                        "attack": 2,
                        "hp": 1
                    },
                    "enemy_siege": {
                        "attack": 2,
                        "hp": 1
                    }
                },
                {
                    "enemy_range": {
                        "attack": 4,
                        "hp": 2
                    },
                    "enemy_siege": {
                        "attack": 4,
                        "hp": 2
                    }
                },
                {
                    "enemy_range": {
                        "attack": 4,
                        "hp": 2
                    },
                    "enemy_siege": {
                        "attack": 4,
                        "hp": 2
                    }
                },
                {
                    "enemy_range": {
                        "attack": 8,
                        "hp": 4
                    },
                    "enemy_siege": {
                        "attack": 8,
                        "hp": 4
                    }
                }
            ]
        }
    ]
}
